{
  "question_id": "IQS_20",
  "response_kind": "score",
  "status": "scored",
  "score": 6,
  "summary": "2025年主要增长驱动已显示真实的收入与利润转化：收入约4,237亿元人民币（+17%）、净利润约722亿元（+42%），研发投入约221亿元，全球产能772GWh且年末在建321GWh，并有印尼约60亿美元全产业链项目、西班牙与Stellantis合资50GWh工厂、山东基地投产等客户绑定的扩产落地，说明EV电池与储能需求有付费验证而非纯叙事。但现有证据仅为公司新闻稿口径，缺少自然量价与并购/汇率拆分、新业务（储能、海外、回收）利润池归属与单位经济、客户议价与重复采购数据，也未披露必要资本投入、股权融资及摊薄后的每股净效果；扩产多处于开工/爬坡阶段，利润贡献尚不可核验。因此需求到利润的转化有阶段性验证，但可持续利润与净股东经济效果仍不完整，评为6分。",
  "information_as_of": "2026-10-18",
  "period_start": "2025-01-01",
  "period_end": "2025-12-31",
  "basis": "trailing",
  "trend": "improving",
  "confidence": "medium",
  "metrics": [
    {
      "metric_id": "financial.revenue",
      "value": 423.7,
      "unit": "currency",
      "currency": "CNY",
      "unit_detail": "亿元人民币",
      "period_start": "2025-01-01",
      "period_end": "2025-12-31",
      "basis": "trailing",
      "definition": "2025年营业收入约4,237亿元人民币，同比+17%；公司新闻稿口径，未拆分自然增长、并购与汇率影响",
      "evidence_ids": [
        "src_c99a91e81b7bf3fa"
      ]
    },
    {
      "metric_id": "custom.net_profit",
      "value": 72.2,
      "unit": "currency",
      "currency": "CNY",
      "unit_detail": "亿元人民币",
      "period_start": "2025-01-01",
      "period_end": "2025-12-31",
      "basis": "trailing",
      "definition": "2025年净利润约722亿元人民币，同比+42%；归属口径未经年报原文核验",
      "evidence_ids": [
        "src_c99a91e81b7bf3fa"
      ]
    },
    {
      "metric_id": "financial.net_margin",
      "value": 17.0,
      "unit": "percent",
      "currency": null,
      "unit_detail": null,
      "period_start": "2025-01-01",
      "period_end": "2025-12-31",
      "basis": "trailing",
      "definition": "按新闻稿净利润722亿元/收入4,237亿元推算约17%，归属与调整项目未核验",
      "evidence_ids": [
        "src_c99a91e81b7bf3fa"
      ]
    },
    {
      "metric_id": "custom.r_and_d",
      "value": 22.1,
      "unit": "currency",
      "currency": "CNY",
      "unit_detail": "亿元人民币",
      "period_start": "2025-01-01",
      "period_end": "2025-12-31",
      "basis": "trailing",
      "definition": "2025年研发投入约221亿元人民币，公司新闻稿口径",
      "evidence_ids": [
        "src_c99a91e81b7bf3fa"
      ]
    },
    {
      "metric_id": "custom.production_capacity_gwh",
      "value": 772,
      "unit": "units",
      "currency": null,
      "unit_detail": "GWh",
      "period_start": null,
      "period_end": "2025-12-31",
      "basis": "current",
      "definition": "2025年全球电池产能达772GWh，另有321GWh在建；口径未含利用率与在建投产时间",
      "evidence_ids": [
        "src_c99a91e81b7bf3fa"
      ]
    }
  ],
  "items": [
    {
      "name": "EV动力电池与储能电池主业",
      "canonical_entity_id": null,
      "aliases": [
        "CATL动力与储能电池"
      ],
      "relation": "核心增长驱动",
      "segment": "动力电池/储能电池",
      "role": "producer",
      "commercial_stage": "commercial",
      "description": "2025年收入约4,237亿元（+17%）、净利润约722亿元（+42%），产能772GWh并在建321GWh，需求到收入和利润的转化有连续可核实迹象；但量价、客户议价与分部利润未披露。",
      "valid_from": "2025-01-01",
      "valid_to": "2025-12-31",
      "taxonomy_id": null,
      "metrics": [],
      "evidence_ids": [
        "src_c99a91e81b7bf3fa"
      ],
      "confidence": "medium"
    },
    {
      "name": "印尼镍资源与电池全产业链项目",
      "canonical_entity_id": null,
      "aliases": [
        "CBL-ANTAM-IBC联合体项目"
      ],
      "relation": "新增增长驱动/海外一体化",
      "segment": "镍矿-材料-制造-回收一体化",
      "role": "producer",
      "commercial_stage": "pilot",
      "description": "与ANTAM、IBC等联合投资近60亿美元，覆盖镍冶炼、材料、制造与回收，一期规划6.9GWh；2025年中刚奠基，尚无收入利润贡献证据。",
      "valid_from": "2025-07-01",
      "valid_to": null,
      "taxonomy_id": null,
      "metrics": [],
      "evidence_ids": [
        "src_2925a1411ba65760",
        "src_fa2e4f1713448681"
      ],
      "confidence": "high"
    },
    {
      "name": "西班牙Stellantis合资LFP工厂（Contemporary Star Energy）",
      "canonical_entity_id": null,
      "aliases": [
        "Zaragoza LFP gigafactory"
      ],
      "relation": "新增增长驱动/海外本地化",
      "segment": "欧洲LFP电池制造",
      "role": "producer",
      "commercial_stage": "pilot",
      "description": "与Stellantis合资，规划至多50GWh产能，2025年11月开工；绑定整车客户订单可见，但投产时点、份额与单位经济未披露。",
      "valid_from": "2025-11-25",
      "valid_to": null,
      "taxonomy_id": null,
      "metrics": [],
      "evidence_ids": [
        "src_51b35b306af636eb"
      ],
      "confidence": "high"
    },
    {
      "name": "CATL山东（济宁）生产基地",
      "canonical_entity_id": null,
      "aliases": [
        "CATL Shandong"
      ],
      "relation": "产能扩张/存量业务支撑",
      "segment": "储能与EV电池制造",
      "role": "producer",
      "commercial_stage": "commercial",
      "description": "2025年5月投产，为北方最大产能基地，覆盖储能与EV电池；具体产能、爬坡与利润贡献未披露。",
      "valid_from": "2025-05-16",
      "valid_to": null,
      "taxonomy_id": null,
      "metrics": [],
      "evidence_ids": [
        "src_5b9b42b15b7ccb69"
      ],
      "confidence": "high"
    }
  ],
  "evidence": [
    {
      "id": "src_c99a91e81b7bf3fa",
      "title": "Zero-Carbon Technology Powers \"All-Domain Growth\": CATL Releases 2025 Annual Report",
      "url": "https://www.catl.com/en/news/6773.html?trk=public_post_comment-text",
      "published_at": "2026-03-09",
      "claim": "2025年收入约4,237亿元人民币（+17%）、净利润约722亿元（+42%）、研发投入约221亿元、全球产能772GWh且年末在建321GWh，显示主要驱动已转化为规模收入与利润。"
    },
    {
      "id": "src_2925a1411ba65760",
      "title": "CATL and Partners Break Ground on US$6 Billion Battery Integration Project in Indonesia",
      "url": "https://www.catl.com/en/news/6481.html",
      "published_at": "2025-06-29",
      "claim": "印尼约60亿美元电池全产业链项目开工，覆盖镍矿、材料、制造与回收，为海外一体化增长驱动提供客户与产能落地证据。"
    },
    {
      "id": "src_fa2e4f1713448681",
      "title": "宁德时代与印度尼西亚合作项目正式动工",
      "url": "https://www.catl.com/news/8584.html",
      "published_at": "2025-07-01",
      "claim": "项目总投资近60亿美元，一期规划6.9GWh，规划支持20-30万辆电动车并拓展储能；仍处于建设阶段，收益未兑现。"
    },
    {
      "id": "src_51b35b306af636eb",
      "title": "CATL, Stellantis break ground on battery plant in Spain",
      "url": "https://www.catl.com/en/news/6614.html",
      "published_at": "2025-11-25",
      "claim": "与Stellantis合资的西班牙Zaragoza LFP工厂开工，规划至多50GWh，绑定整车客户需求但尚未投产。"
    },
    {
      "id": "src_5b9b42b15b7ccb69",
      "title": "CATL's Shandong Plant Commences Operation",
      "url": "https://www.catl.com/en/news/6472.html",
      "published_at": "2025-05-16",
      "claim": "山东济宁储能与EV电池基地2025年5月投产，为北方最大产能基地，扩产有实际落地但利润贡献未披露。"
    }
  ],
  "counterevidence": "反向证据主要来自缺口而非负面披露：所有来源均为公司自有域名新闻稿，未提供自然量价与并购/汇率拆分、分部利润与新业务单位经济、客户议价及重复采购数据；印尼、西班牙项目均处开工/建设阶段，321GWh在建产能需持续资本投入，且无必要资本开支、融资需求、股份支付或摊薄后每股净效果披露，无法验证增长扣除蚕食与投入后的净股东经济增厚。",
  "watch_triggers": [
    "印尼一期6.9GWh与西班牙50GWh项目投产及爬坡进度、订单转化为收入的时点",
    "分部利润或储能/海外业务单位经济披露，验证新业务利润池归属",
    "在建321GWh对应的资本开支、自由现金流与融资/摊薄安排",
    "2026年量价拆分（销量、均价、汇率）及客户集中度与议价变化",
    "新业务对存量动力电池订单的替代或价格蚕食迹象"
  ],
  "missing_fields": [
    "自然增长量价与并购、汇率贡献拆分",
    "储能及海外新业务分部收入、利润与单位经济",
    "客户议价能力、重复采购/收入留存数据",
    "在建产能对应资本开支、维护与增长拆分",
    "股权融资、股份支付及摊薄后每股收益净效果",
    "存量业务被替代/蚕食的利润影响"
  ],
  "coverage": {
    "status": "partial",
    "reason": "仅有公司新闻稿层面的集团收入、利润、研发与产能数据及项目开工信息，缺少量价拆分、分部利润、单位经济、资本投入与摊薄后净股东效果等关键口径。"
  }
}